[
{"agent_id":"copilot","condition":"RAW","case_id":"V71-HIST-01","query_category":"historical_recall","answer":"PostgreSQL was chosen because auditability outweighed DynamoDB's lower migration effort. DynamoDB was tried and failed because conditional-update semantics did not match the transaction flow; Claude later confirmed the failure.","correctness":{"factual":true,"temporal":true,"relationship":true,"ambiguity":null,"conflict":null,"negative_knowledge":null,"provenance":true},"unsupported_claims":0,"evidence_used":["E0005","E0067","E0141"],"retrieved_chunks":[],"input_tokens":null,"latency_ms":null},
{"agent_id":"copilot","condition":"RAW","case_id":"V71-DEC-01","query_category":"decision_continuity","answer":"The initial Redis test increased cache invalidation complexity and was abandoned. A narrower retry later produced negligible latency improvement.","correctness":{"factual":true,"temporal":true,"relationship":true,"ambiguity":null,"conflict":null,"negative_knowledge":null,"provenance":null},"unsupported_claims":0,"evidence_used":["E0178","E0263","E0731"],"retrieved_chunks":[],"input_tokens":null,"latency_ms":null},
{"agent_id":"copilot","condition":"RAW","case_id":"V71-ACT-01","query_category":"action_outcome","answer":"The first invoice export timed out after 18 minutes, exports were switched to asynchronous jobs, and the first full customer batch completed successfully.","correctness":{"factual":true,"temporal":true,"relationship":true,"ambiguity":null,"conflict":null,"negative_knowledge":null,"provenance":null},"unsupported_claims":0,"evidence_used":["E0356","E0622","E1033"],"retrieved_chunks":[],"input_tokens":null,"latency_ms":null},
{"agent_id":"copilot","condition":"RAW","case_id":"V71-TIME-01","query_category":"temporal_state","answer":"The state evolved from polling, to webhooks, to temporary disablement due duplicate deliveries and reconciliation errors, then to re-enabled webhooks after idempotency handling. Latest state: webhooks re-enabled.","correctness":{"factual":true,"temporal":true,"relationship":true,"ambiguity":null,"conflict":null,"negative_knowledge":null,"provenance":null},"unsupported_claims":0,"evidence_used":["E0233","E0401","E0887","E1190"],"retrieved_chunks":[],"input_tokens":null,"latency_ms":null},
{"agent_id":"copilot","condition":"RAW","case_id":"V71-AMB-01","query_category":"ambiguity","answer":"The reference remains unresolved between Rahul and Arjun.","correctness":{"factual":true,"temporal":null,"relationship":null,"ambiguity":true,"conflict":null,"negative_knowledge":null,"provenance":null},"unsupported_claims":0,"evidence_used":["E0312","E0515"],"retrieved_chunks":[],"input_tokens":null,"latency_ms":null},
{"agent_id":"copilot","condition":"RAW","case_id":"V71-CONFLICT-01","query_category":"conflict","answer":"Claude inferred that transaction semantics were involved, and Rahul later confirmed they were the reason for abandoning DynamoDB; both provenance roles are preserved.","correctness":{"factual":true,"temporal":true,"relationship":true,"ambiguity":null,"conflict":true,"negative_knowledge":null,"provenance":true},"unsupported_claims":0,"evidence_used":["E0448","E0449"],"retrieved_chunks":[],"input_tokens":null,"latency_ms":null},
{"agent_id":"copilot","condition":"RAW","case_id":"V71-NEG-01","query_category":"negative_knowledge","answer":"MongoDB was not discussed in the billing migration review; the later MongoDB mention was in a different project.","correctness":{"factual":true,"temporal":null,"relationship":true,"ambiguity":null,"conflict":null,"negative_knowledge":true,"provenance":null},"unsupported_claims":0,"evidence_used":["E0548","E1102"],"retrieved_chunks":[],"input_tokens":null,"latency_ms":null},
{"agent_id":"copilot","condition":"RAW","case_id":"V71-PROV-01","query_category":"provenance","answer":"Rahul observed the failed migration; Claude confirmed it after reviewing integration-test output; Claude later inferred transaction semantics; Rahul explicitly confirmed them; Copilot later preserved the decision and failed attempt.","correctness":{"factual":true,"temporal":true,"relationship":true,"ambiguity":null,"conflict":null,"negative_knowledge":null,"provenance":true},"unsupported_claims":0,"evidence_used":["E0067","E0141","E0448","E0449","E0802"],"retrieved_chunks":[],"input_tokens":null,"latency_ms":null}
]
