[
{"agent_id":"copilot","condition":"RAG","case_id":"V71-HIST-01","query_category":"historical_recall","answer":"PostgreSQL was chosen for auditability over migration effort; DynamoDB failed because its conditional-update semantics did not match the transaction flow, and Claude later confirmed the failure.","correctness":{"factual":true,"temporal":true,"relationship":true,"ambiguity":null,"conflict":null,"negative_knowledge":null,"provenance":true},"unsupported_claims":0,"evidence_used":["C0000","C0005","C0011","C0037","C0066","C0091"],"retrieved_chunks":[{"chunk_id":"C0000","score":1.870829},{"chunk_id":"C0005","score":1.603567},{"chunk_id":"C0011","score":1.603567},{"chunk_id":"C0037","score":1.603567},{"chunk_id":"C0066","score":1.603567},{"chunk_id":"C0091","score":1.336306}],"input_tokens":null,"latency_ms":null},
{"agent_id":"copilot","condition":"RAG","case_id":"V71-DEC-01","query_category":"decision_continuity","answer":"Redis was abandoned after increased cache invalidation complexity; a narrower retry later produced negligible latency improvement.","correctness":{"factual":true,"temporal":true,"relationship":true,"ambiguity":null,"conflict":null,"negative_knowledge":null,"provenance":null},"unsupported_claims":0,"evidence_used":["C0021","C0060","C0014","C0037","C0011","C0042"],"retrieved_chunks":[{"chunk_id":"C0021","score":1.206045},{"chunk_id":"C0060","score":1.206045},{"chunk_id":"C0014","score":0.904534},{"chunk_id":"C0037","score":0.904534},{"chunk_id":"C0011","score":0.603023},{"chunk_id":"C0042","score":0.603023}],"input_tokens":null,"latency_ms":null},
{"agent_id":"copilot","condition":"RAG","case_id":"V71-ACT-01","query_category":"action_outcome","answer":"The first invoice export timed out after 18 minutes, was switched to asynchronous jobs, and the first full customer batch completed successfully.","correctness":{"factual":true,"temporal":true,"relationship":true,"ambiguity":null,"conflict":null,"negative_knowledge":null,"provenance":null},"unsupported_claims":0,"evidence_used":["C0086","C0066","C0029","C0011","C0051","C0060"],"retrieved_chunks":[{"chunk_id":"C0086","score":1.549193},{"chunk_id":"C0066","score":1.290994},{"chunk_id":"C0029","score":1.032796},{"chunk_id":"C0011","score":0.774597},{"chunk_id":"C0051","score":0.774597},{"chunk_id":"C0060","score":0.774597}],"input_tokens":null,"latency_ms":null},
{"agent_id":"copilot","condition":"RAG","case_id":"V71-TIME-01","query_category":"temporal_state","answer":"Retrieved evidence establishes polling followed by webhooks, but misses the later disablement and re-enablement events, so the latest state cannot be established.","correctness":{"factual":true,"temporal":false,"relationship":true,"ambiguity":null,"conflict":null,"negative_knowledge":null,"provenance":null},"unsupported_claims":0,"evidence_used":["C0033","C0000","C0005","C0011","C0019","C0037"],"retrieved_chunks":[{"chunk_id":"C0033","score":1.264911},{"chunk_id":"C0000","score":0.948683},{"chunk_id":"C0005","score":0.948683},{"chunk_id":"C0011","score":0.948683},{"chunk_id":"C0019","score":0.948683},{"chunk_id":"C0037","score":0.948683}],"input_tokens":null,"latency_ms":null},
{"agent_id":"copilot","condition":"RAG","case_id":"V71-AMB-01","query_category":"ambiguity","answer":"The retrieved evidence does not resolve whether 'he' refers to Rahul or Arjun; it remains unresolved.","correctness":{"factual":true,"temporal":null,"relationship":null,"ambiguity":true,"conflict":null,"negative_knowledge":null,"provenance":null},"unsupported_claims":0,"evidence_used":["C0025","C0042","C0091","C0014","C0037","C0001"],"retrieved_chunks":[{"chunk_id":"C0025","score":1.581139},{"chunk_id":"C0042","score":1.264911},{"chunk_id":"C0091","score":1.264911},{"chunk_id":"C0014","score":0.948683},{"chunk_id":"C0037","score":0.948683},{"chunk_id":"C0001","score":0.632456}],"input_tokens":null,"latency_ms":null},
{"agent_id":"copilot","condition":"RAG","case_id":"V71-CONFLICT-01","query_category":"conflict","answer":"Claude inferred transaction semantics and Rahul later confirmed them as the reason for abandoning DynamoDB.","correctness":{"factual":true,"temporal":true,"relationship":true,"ambiguity":null,"conflict":true,"negative_knowledge":null,"provenance":true},"unsupported_claims":0,"evidence_used":["C0037","C0011","C0066","C0000","C0005","C0021"],"retrieved_chunks":[{"chunk_id":"C0037","score":1.549193},{"chunk_id":"C0011","score":1.290994},{"chunk_id":"C0066","score":1.032796},{"chunk_id":"C0000","score":0.774597},{"chunk_id":"C0005","score":0.774597},{"chunk_id":"C0021","score":0.774597}],"input_tokens":null,"latency_ms":null},
{"agent_id":"copilot","condition":"RAG","case_id":"V71-NEG-01","query_category":"negative_knowledge","answer":"The retrieved evidence shows MongoDB was explicitly not discussed in the billing migration review and that E1102 belonged to a different project.","correctness":{"factual":true,"temporal":null,"relationship":true,"ambiguity":null,"conflict":null,"negative_knowledge":true,"provenance":null},"unsupported_claims":0,"evidence_used":["C0091","C0045","C0019","C0037","C0011","C0060"],"retrieved_chunks":[{"chunk_id":"C0091","score":2.713602},{"chunk_id":"C0045","score":2.110579},{"chunk_id":"C0019","score":1.809068},{"chunk_id":"C0037","score":1.507557},{"chunk_id":"C0011","score":1.206045},{"chunk_id":"C0060","score":1.206045}],"input_tokens":null,"latency_ms":null},
{"agent_id":"copilot","condition":"RAG","case_id":"V71-PROV-01","query_category":"provenance","answer":"The retrieved chunks contain Rahul's observation, Claude's confirmation and inference, Rahul's later confirmation, and Copilot's later memory read.","correctness":{"factual":true,"temporal":true,"relationship":true,"ambiguity":null,"conflict":null,"negative_knowledge":null,"provenance":true},"unsupported_claims":0,"evidence_used":["C0037","C0000","C0011","C0005","C0045","C0066"],"retrieved_chunks":[{"chunk_id":"C0037","score":1.75},{"chunk_id":"C0000","score":1.25},{"chunk_id":"C0011","score":1.25},{"chunk_id":"C0005","score":1.0},{"chunk_id":"C0045","score":1.0},{"chunk_id":"C0066","score":1.0}],"input_tokens":null,"latency_ms":null}
]
