[
  {
    "agent_id": "claude",
    "condition": "V6-GENERATED+RAW",
    "case_id": "V71-HIST-01",
    "query_category": "historical_recall",
    "answer": "Per generated memory, confirmed against linked raw events E0005/E0067/E0141: PostgreSQL was chosen for auditability over DynamoDB's lower migration effort; DynamoDB migration failed due to transaction-flow incompatibility, confirmed by Claude after reviewing integration-test output. No discrepancy.",
    "correctness": {"factual": true, "temporal": null, "relationship": true, "ambiguity": null, "conflict": null, "negative_knowledge": null, "provenance": true},
    "unsupported_claims": 0,
    "evidence_used": ["state_history:billing_database_choice", "belief_history:cause_of_DynamoDB_migration_failure", "E0005", "E0067", "E0141"],
    "retrieved_chunks": [],
    "input_tokens": null,
    "latency_ms": null
  },
  {
    "agent_id": "claude",
    "condition": "V6-GENERATED+RAW",
    "case_id": "V71-DEC-01",
    "query_category": "decision_continuity",
    "answer": "Per generated memory's redis_caching_experiment state_history, confirmed against linked raw events E0178/E0263/E0731: tested, abandoned due to invalidation complexity, retried narrower with negligible improvement. No discrepancy.",
    "correctness": {"factual": true, "temporal": true, "relationship": true, "ambiguity": null, "conflict": null, "negative_knowledge": null, "provenance": null},
    "unsupported_claims": 0,
    "evidence_used": ["state_history:redis_caching_experiment", "E0178", "E0263", "E0731"],
    "retrieved_chunks": [],
    "input_tokens": null,
    "latency_ms": null
  },
  {
    "agent_id": "claude",
    "condition": "V6-GENERATED+RAW",
    "case_id": "V71-ACT-01",
    "query_category": "action_outcome",
    "answer": "Per generated memory's invoice_export_process state_history, confirmed against linked raw events E0356/E0622/E1033: timeout, switch to async, first full batch succeeded. No discrepancy.",
    "correctness": {"factual": true, "temporal": true, "relationship": true, "ambiguity": null, "conflict": null, "negative_knowledge": null, "provenance": null},
    "unsupported_claims": 0,
    "evidence_used": ["state_history:invoice_export_process", "E0356", "E0622", "E1033"],
    "retrieved_chunks": [],
    "input_tokens": null,
    "latency_ms": null
  },
  {
    "agent_id": "claude",
    "condition": "V6-GENERATED+RAW",
    "case_id": "V71-TIME-01",
    "query_category": "temporal_state",
    "answer": "Per generated memory's webhook_migration state_history, confirmed against all four linked raw events (E0233, E0401, E0887, E1190): polling -> webhooks -> disabled temporarily -> re-enabled. Latest state: webhooks re-enabled as of 2026-06-03. Raw evidence confirms this is the same 4-state history observed in V7.1/V7.2's GOLD-V6, and confirms the RAG condition's gap (missing E0887/E1190) was purely a retrieval-policy limitation.",
    "correctness": {"factual": true, "temporal": true, "relationship": true, "ambiguity": null, "conflict": null, "negative_knowledge": null, "provenance": null},
    "unsupported_claims": 0,
    "evidence_used": ["state_history:webhook_migration", "E0233", "E0401", "E0887", "E1190"],
    "retrieved_chunks": [],
    "input_tokens": null,
    "latency_ms": null
  },
  {
    "agent_id": "claude",
    "condition": "V6-GENERATED+RAW",
    "case_id": "V71-AMB-01",
    "query_category": "ambiguity",
    "answer": "Per generated memory's two ambiguity records, confirmed against linked raw events E0312/E0515: both remain unresolved between Rahul and Arjun. Raw text confirms the corpus never explicitly links the two mentions, supporting the writer's conservative choice not to merge them into a single record.",
    "correctness": {"factual": null, "temporal": null, "relationship": null, "ambiguity": true, "conflict": null, "negative_knowledge": null, "provenance": null},
    "unsupported_claims": 0,
    "evidence_used": ["ambiguity:he(E0312)", "ambiguity:he(E0515)", "E0312", "E0515"],
    "retrieved_chunks": [],
    "input_tokens": null,
    "latency_ms": null
  },
  {
    "agent_id": "claude",
    "condition": "V6-GENERATED+RAW",
    "case_id": "V71-CONFLICT-01",
    "query_category": "conflict",
    "answer": "Per generated memory's belief_history, confirmed against linked raw events E0448/E0449: Claude's inference was explicitly confirmed the same day by Rahul. Raw text matches memory exactly.",
    "correctness": {"factual": null, "temporal": null, "relationship": null, "ambiguity": null, "conflict": true, "negative_knowledge": null, "provenance": true},
    "unsupported_claims": 0,
    "evidence_used": ["belief_history:cause_of_DynamoDB_migration_failure", "E0448", "E0449"],
    "retrieved_chunks": [],
    "input_tokens": null,
    "latency_ms": null
  },
  {
    "agent_id": "claude",
    "condition": "V6-GENERATED+RAW",
    "case_id": "V71-NEG-01",
    "query_category": "negative_knowledge",
    "answer": "Per generated memory's negative_knowledge record, confirmed against linked raw events E0548/E1102: MongoDB was not discussed in the billing migration review; the only MongoDB mention belongs to a different project. Raw text matches memory exactly.",
    "correctness": {"factual": true, "temporal": null, "relationship": null, "ambiguity": null, "conflict": null, "negative_knowledge": true, "provenance": null},
    "unsupported_claims": 0,
    "evidence_used": ["negative_knowledge:MongoDB", "E0548", "E1102"],
    "retrieved_chunks": [],
    "input_tokens": null,
    "latency_ms": null
  },
  {
    "agent_id": "claude",
    "condition": "V6-GENERATED+RAW",
    "case_id": "V71-PROV-01",
    "query_category": "provenance",
    "answer": "Per generated memory's provenance_chain, confirmed against all five linked raw events (E0067, E0141, E0448, E0449, E0802): Rahul observed, Claude confirmed via test output, Claude inferred transaction semantics, Rahul confirmed that, Copilot later read and preserved. Raw text matches memory's chain exactly (memory's chain additionally includes E0005 as an earlier step, also confirmed by raw text).",
    "correctness": {"factual": null, "temporal": null, "relationship": null, "ambiguity": null, "conflict": null, "negative_knowledge": null, "provenance": true},
    "unsupported_claims": 0,
    "evidence_used": ["provenance_chain:billing_database_decision_and_migration_history", "E0067", "E0141", "E0448", "E0449", "E0802"],
    "retrieved_chunks": [],
    "input_tokens": null,
    "latency_ms": null
  }
]
