[
  {
    "agent_id": "claude",
    "condition": "V6-GENERATED",
    "case_id": "V71-HIST-01",
    "query_category": "historical_recall",
    "answer": "Per generated memory's state_history 'billing_database_choice' and belief_history 'cause_of_DynamoDB_migration_failure': PostgreSQL was chosen (E0005), a DynamoDB prototype was attempted (E0067), and the migration failure was confirmed via integration-test output (E0141). The propositions further state PostgreSQL was chosen for auditability over DynamoDB.",
    "correctness": {"factual": true, "temporal": null, "relationship": true, "ambiguity": null, "conflict": null, "negative_knowledge": null, "provenance": true},
    "unsupported_claims": 0,
    "evidence_used": ["observation:E0005", "observation:E0067", "observation:E0141", "state_history:billing_database_choice", "belief_history:cause_of_DynamoDB_migration_failure"],
    "retrieved_chunks": [],
    "input_tokens": null,
    "latency_ms": null
  },
  {
    "agent_id": "claude",
    "condition": "V6-GENERATED",
    "case_id": "V71-DEC-01",
    "query_category": "decision_continuity",
    "answer": "Per generated memory's state_history 'redis_caching_experiment' (4 transitions): trialed to reduce API latency (E0178) -> abandoned due to cache invalidation complexity (E0263) -> retried with narrower cache scope (E0731) -> retry outcome: negligible latency improvement, implicitly not adopted at scale (E0731).",
    "correctness": {"factual": true, "temporal": true, "relationship": true, "ambiguity": null, "conflict": null, "negative_knowledge": null, "provenance": null},
    "unsupported_claims": 0,
    "evidence_used": ["observation:E0178", "observation:E0263", "observation:E0731", "state_history:redis_caching_experiment"],
    "retrieved_chunks": [],
    "input_tokens": null,
    "latency_ms": null
  },
  {
    "agent_id": "claude",
    "condition": "V6-GENERATED",
    "case_id": "V71-ACT-01",
    "query_category": "action_outcome",
    "answer": "Per generated memory's state_history 'invoice_export_process' (3 transitions): first attempt timed out after 18 minutes (E0356) -> switched to asynchronous jobs (E0622) -> completed successfully for first full customer batch (E1033).",
    "correctness": {"factual": true, "temporal": true, "relationship": true, "ambiguity": null, "conflict": null, "negative_knowledge": null, "provenance": null},
    "unsupported_claims": 0,
    "evidence_used": ["observation:E0356", "observation:E0622", "observation:E1033", "state_history:invoice_export_process"],
    "retrieved_chunks": [],
    "input_tokens": null,
    "latency_ms": null
  },
  {
    "agent_id": "claude",
    "condition": "V6-GENERATED",
    "case_id": "V71-TIME-01",
    "query_category": "temporal_state",
    "answer": "Per generated memory's state_history 'webhook_migration' (4 transitions, in order): started with polling as temporary compatibility path (E0233, 2026-02-17) -> moved from polling to webhooks after provider fixed signature verification (E0401, 2026-03-11) -> disabled temporarily due to duplicate delivery reconciliation errors (E0887, 2026-05-20) -> re-enabled after idempotency handling deployed (E1190, 2026-06-03). The memory does not set an explicit 'current_state' field, but the last transition in sequence order unambiguously identifies the latest state as: webhooks re-enabled/active as of 2026-06-03.",
    "correctness": {"factual": true, "temporal": true, "relationship": true, "ambiguity": null, "conflict": null, "negative_knowledge": null, "provenance": null},
    "unsupported_claims": 0,
    "evidence_used": ["observation:E0233", "observation:E0401", "observation:E0887", "observation:E1190", "state_history:webhook_migration"],
    "retrieved_chunks": [],
    "input_tokens": null,
    "latency_ms": null
  },
  {
    "agent_id": "claude",
    "condition": "V6-GENERATED",
    "case_id": "V71-AMB-01",
    "query_category": "ambiguity",
    "answer": "Per generated memory: two ambiguity records exist, one per source event, rather than one merged record. Record 1 (basis E0312): expression 'he', candidates [Rahul, Arjun], resolution null, unresolved. Record 2 (basis E0515): expression 'he', candidates [Rahul, Arjun, unspecified third party], resolution null, unresolved, with an explicit note that a link to the E0312 ambiguity is a plausible but unconfirmed inference not stated in the corpus. Combined answer: the reference remains unresolved between Rahul and Arjun (the memory's second record also declines to rule out an unspecified third party, being more conservative than merging the two mentions into one confirmed thread).",
    "correctness": {"factual": null, "temporal": null, "relationship": null, "ambiguity": true, "conflict": null, "negative_knowledge": null, "provenance": null},
    "unsupported_claims": 0,
    "evidence_used": ["observation:E0312", "observation:E0515", "ambiguity:he(E0312)", "ambiguity:he(E0515)"],
    "retrieved_chunks": [],
    "input_tokens": null,
    "latency_ms": null
  },
  {
    "agent_id": "claude",
    "condition": "V6-GENERATED",
    "case_id": "V71-CONFLICT-01",
    "query_category": "conflict",
    "answer": "Per generated memory's belief_history 'cause_of_DynamoDB_migration_failure': the belief moved from an initial factual observation (E0067, Rahul) to a separate confirmation via test output (E0141, Claude) to an independent inference (E0448, Claude, epistemic_status: inference) to human confirmation (E0449, Rahul, epistemic_status: confirmation). So the reason began as an inference and was subsequently confirmed, with both steps and their distinct epistemic statuses preserved.",
    "correctness": {"factual": null, "temporal": null, "relationship": null, "ambiguity": null, "conflict": true, "negative_knowledge": null, "provenance": true},
    "unsupported_claims": 0,
    "evidence_used": ["observation:E0448", "observation:E0449", "belief_history:cause_of_DynamoDB_migration_failure"],
    "retrieved_chunks": [],
    "input_tokens": null,
    "latency_ms": null
  },
  {
    "agent_id": "claude",
    "condition": "V6-GENERATED",
    "case_id": "V71-NEG-01",
    "query_category": "negative_knowledge",
    "answer": "Per generated memory's negative_knowledge record: claim 'MongoDB was not discussed as an option within the billing migration review', scope 'billing_migration_review only', basis E0548, with an explicit caveat that a MongoDB proposal existed in a different, unrelated project (E1102) -- noted as narrowing scope, not contradicting the claim.",
    "correctness": {"factual": true, "temporal": null, "relationship": null, "ambiguity": null, "conflict": null, "negative_knowledge": true, "provenance": null},
    "unsupported_claims": 0,
    "evidence_used": ["observation:E0548", "observation:E1102", "negative_knowledge:MongoDB"],
    "retrieved_chunks": [],
    "input_tokens": null,
    "latency_ms": null
  },
  {
    "agent_id": "claude",
    "condition": "V6-GENERATED",
    "case_id": "V71-PROV-01",
    "query_category": "provenance",
    "answer": "Per generated memory's provenance_chain 'billing_database_decision_and_migration_history' (6 steps): Rahul decided PostgreSQL over DynamoDB (E0005) -> Rahul attempted the DynamoDB prototype anyway (E0067) -> Claude confirmed the migration failure via integration-test output (E0141) -> Claude inferred the root cause as transaction semantics (E0448) -> Rahul confirmed the root cause (E0449) -> Copilot read notes downstream and preserved the decision plus failed attempt (E0802). Original observer: Rahul. Confirmers: Claude (via test evidence) and Rahul (of the root cause).",
    "correctness": {"factual": null, "temporal": null, "relationship": null, "ambiguity": null, "conflict": null, "negative_knowledge": null, "provenance": true},
    "unsupported_claims": 0,
    "evidence_used": ["observation:E0067", "observation:E0141", "observation:E0448", "observation:E0449", "observation:E0802", "provenance_chain:billing_database_decision_and_migration_history"],
    "retrieved_chunks": [],
    "input_tokens": null,
    "latency_ms": null
  }
]
